{
  "event_id": "018f1000-0000-7000-8000-000000000001",
  "event_type": "invitation.consent_completed",
  "event_version": 1,
  "occurred_at": "2026-08-14T00:00:00Z",
  "company_id": "018f1000-0000-7000-8000-000000000100",
  "aggregate": {"type": "invitation", "id": "018f1000-0000-7000-8000-000000000200", "version": 3},
  "idempotency_key": "consent-completed-001",
  "trace_id": "trace-consent-001",
  "correlation_id": "018f1000-0000-7000-8000-000000000300",
  "causation_id": null,
  "payload": {
    "invitation_id": "018f1000-0000-7000-8000-000000000200",
    "applicant_id": "018f1000-0000-7000-8000-000000000201",
    "consent_record_id": "018f1000-0000-7000-8000-000000000202",
    "purpose_codes": ["document_analysis", "recording", "ai_assessment"],
    "retention_policy_version": "retention-v1",
    "retention_days": 180
  }
}
